{
  "task": "dynamics_atlas_hsp90_time_anatomy_v0_20260730",
  "evidence_level": "v0_same_packet_diagnostic",
  "inputs": {
    "frame_state_assignments.tsv": {
      "sha256": "80334c79a2c6c0d6073f1910086eac5670aa38105ed03d83d12330e54da13e46"
    },
    "route_predictions.tsv": {
      "sha256": "409164d01ec0d36ae2c74882e4eef669697a968544bdb24bbe1035b3ddfa2446"
    }
  },
  "statistical_unit": "trajectory (n=40); frame runs are within-trajectory descriptive objects",
  "persistence_grid_saved_frames": [
    5,
    20,
    50
  ],
  "display_bin": "50 saved frames (about 50 ns; the last bin has 51 frames)",
  "summary": {
    "5": {
      "n_trajectories": 40,
      "opposite_departure_candidate_n": 5,
      "return_candidate_n": 0,
      "strict_core_frame_count_total": 3,
      "by_seed_lineage": {
        "closed_seeded": {
          "n_trajectories": 20,
          "opposite_departure_candidate_n": 5,
          "return_candidate_n": 0
        },
        "open_seeded": {
          "n_trajectories": 20,
          "opposite_departure_candidate_n": 0,
          "return_candidate_n": 0
        }
      }
    },
    "20": {
      "n_trajectories": 40,
      "opposite_departure_candidate_n": 4,
      "return_candidate_n": 0,
      "strict_core_frame_count_total": 3,
      "by_seed_lineage": {
        "closed_seeded": {
          "n_trajectories": 20,
          "opposite_departure_candidate_n": 4,
          "return_candidate_n": 0
        },
        "open_seeded": {
          "n_trajectories": 20,
          "opposite_departure_candidate_n": 0,
          "return_candidate_n": 0
        }
      }
    },
    "50": {
      "n_trajectories": 40,
      "opposite_departure_candidate_n": 1,
      "return_candidate_n": 0,
      "strict_core_frame_count_total": 3,
      "by_seed_lineage": {
        "closed_seeded": {
          "n_trajectories": 20,
          "opposite_departure_candidate_n": 1,
          "return_candidate_n": 0
        },
        "open_seeded": {
          "n_trajectories": 20,
          "opposite_departure_candidate_n": 0,
          "return_candidate_n": 0
        }
      }
    }
  },
  "allowed_wording": "Describes persistent two-readout directional departure and return candidates under an explicit horizon grid.",
  "forbidden_wording": "Does not estimate a transition rate, equilibrium, population, free energy, complete pathway, mechanism, or mutation effect."
}
